profile,status
"Nguyễn Văn Đức là một giáo sư ngành xây dựng và giảng dạy tại đại học Xây dựng Hà Nội. Trong suốt sự nghiệp của tôi, tôi đã tham gia vào nhiều dự án xây dựng lớn, từ các công trình cầu đường cho đến nhà máy. Giáo sư đã có 100 bài báo và 4 giải thưởng",1
"Lê Thị Thu là một thạc sỹ đại học và đã có hơn 10 năm kinh nghiệm trong lĩnh vực khoa học máy tính. Trong thời gian làm việc của mình, tôi đã có nhiều đóng góp quan trọng và công bố 40 bài báo khoa học, giúp cho ngành khoa học máy tính phát triển hơn nữa.",1
"Trong thời gian làm việc của Giáo sư Lê Du Phong, tôi đã công bố nhiều bài báo khoa học quan trọng trong lĩnh vực khoa học máy tính. Giáo sư luôn nỗ lực để đóng góp gần 30 bài nghiên cứu trong nhiều lĩnh vực",1
"Nhà nghiên cứu Trần Văn Đức đã công bố nhiều bài báo khoa học quan trọng trong lĩnh vực sinh học phân tử bao gồm cả những nghiên cứu về COVID-19 và CRISPR-Cas9 hai chủ đề đang nhận được sự quan tâm lớn trong cộng đồng khoa học., nhà nghiên cứu đã công bố 12 bài báo trong danh mục ISI",1
"Nguyễn Văn Chung là một chuyên viên tài chính với hơn 8 năm kinh nghiệm làm việc trong ngành tài chính. Tôi đã có cơ hội hợp tác với anh ấy và thấy rõ sự chuyên nghiệp tỉ mỉ và tận tâm của anh ấy đối với công việc.",1
"Trần Đình Dương là một nhà nghiên cứu về học máy với nhiều 25 nghiên cứu quan trọng được công bố trong các tạp chí uy tín. Tiến sỹ  đã có cơ hội tham gia vào một trong những dự án nghiên cứu và có 2 giải thưởng",1
"Lê Tuấn Hùng tiến sỹ là một chuyên gia hàng đầu về học máy và trí tuệ nhân tạo với nhiều đóng góp 10 bài báo quan trọng cho cộng đồng khoa học.",1
"Trần Văn Thảo là một chuyên gia hàng đầu trong lĩnh vực Marketing mang lại những giá trị đáng kể cho doanh nghiệp và được đánh giá cao trong ngành, ông đã có 3 giải thưởng",1
"Trưởng khoa Đào Duy Toàn là một nhà nghiên cứu về khoa học dữ liệu đóng góp đáng kể vào việc phát triển trí tuệ nhân tạo và được tôn vinh trong cộng đồng khoa học, tiến sỹ đã có 5 bài báo thuộc danh mục Scorpus",1
"Phó giáo sư Lê Đình Hưng đã phát minh ra phương pháp đo siêu chính xác trong lĩnh vực khoa học đóng góp quan trọng cho sự tiến bộ của ngành và được đánh giá cao bởi đồng nghiệp, thầy đã có 8 bài báo và 4 giải thưởng",1
"Tiến sỹ Lê Tuấn Hùng là một nhà nghiên cứu hàng đầu trong lĩnh vực Trí tuệ nhân tạo. Ông đã có những đóng góp đáng kể vào sự phát triển của ngành này bằng cách tham gia vào nhiều dự án nghiên cứu và đào tạo những chuyên gia tương lai trong lĩnh vực này.",1
Trần Văn Bộ là một chuyên gia hàng đầu trong lĩnh vực Marketing. Anh đã mang lại giá trị lớn cho doanh nghiệp bằng cách thiết kế các chiến lược marketing hiệu quả và tối ưu hóa quy trình kinh doanh. Trần Văn Bộ đã giúp nhiều doanh nghiệp đạt được thành công trên thị trường",1
"Đào Duy Toàn là một nhà nghiên cứu về các kỹ thuật máy tính. Ông đã có nhiều đóng góp vào sự phát triển của ngành công nghệ thông tin thông qua việc tham gia vào các dự án nghiên cứu và phát triển các ứng dụng mới.",1
"Tiến sĩ Nguyễn Hữu Đức khoa học với 8 năm kinh nghiệm trong lĩnh vực Sinh học phân tử. Tôi có chuyên môn về CRISPR-Cas9 và đã đóng góp cho 15 nghiên cứu được công bố trong các tạp chí uy tín.",1
"Tiến sĩ Trần Thanh Vân cứu khoa học với 6 năm kinh nghiệm trong lĩnh vực Vật liệu. Tôi có chuyên môn về các vật liệu năng lượng tái tạo và đã công bố 11 bài báo trong các tạp chí quốc tế uy tín.",1
"Phó Giáo sư Tiến sĩ Lê Xuân Tùng với 10 năm kinh nghiệm trong lĩnh vực Y học. Tiến sỹ có chuyên môn về ung thư và đã tham gia nhiều dự án nghiên cứu liên quan đến phát triển thuốc mới, Tiến sỹ có tổng cộng 20 bài báo và 1 giải thưởng.",1
"Tiến sĩ Nguyễn Văn Minh học với 7 năm kinh nghiệm trong lĩnh vực Khoa học Môi trường. Tôi có chuyên môn về tác động của biến đổi khí hậu đến đa dạng sinh học và đã xuất bản 15 nghiên cứu về chủ đề này.",1